{
  "schemaVersion": "finance-component-assembly.v0.1",
  "kind": "capability-pack",
  "owner": {"id": "fraud-risk-evidence-query", "version": "0.1.0"},
  "requiredFeatures": ["query.v1", "trusted-grants.v1", "observation.v0.1", "employee-authority.v1"],
  "defaultDomainPacks": [{"id": "fraud-verification-assistance", "version": "0.1.0"}]
}
