{
  "schemaVersion": "finance-component-assembly.v0.1",
  "kind": "capability-pack",
  "owner": {"id": "post-loan-risk-snapshot", "version": "0.1.0"},
  "requiredFeatures": ["query.v1", "trusted-grants.v1", "observation.v0.1", "employee-authority.v1", "immutable-reports.v1"],
  "defaultDomainPacks": [{"id": "post-loan-risk-verification", "version": "0.1.0"}]
}
