{
  "schemaVersion": "finance-component-assembly.v0.1",
  "kind": "capability-pack",
  "owner": {"id": "smart-audit-personal-loan-audit", "version": "0.1.0"},
  "requiredFeatures": ["query.v1", "trusted-grants.v1", "observation.v0.1"],
  "defaultDomainPacks": [
    {"id": "smart-audit-personal-loan-audit", "version": "0.1.0"}
  ]
}
