{
  "schemaVersion": "finance-component-assembly.v0.1",
  "kind": "provider",
  "owner": {"id": "employee-agent-reference", "version": "0.1.0-SNAPSHOT"},
  "artifactRef": "maven://io.github.bitlhk.finance:finance-provider-employee-agent:0.1.0-SNAPSHOT",
  "connectionKind": "employee-agent-platform-mcp.v1",
  "supports": [{
    "pack": {"id": "wealth-manager-previsit", "version": "0.1.0"},
    "capabilityIds": ["wealth.previsit-context.query"],
    "operation": "QUERY"
  }]
}
