{
  "schemaVersion": "finance-component-assembly.v0.1",
  "kind": "capability-pack",
  "owner": {"id": "wealth-product-facts", "version": "0.1.0"},
  "requiredFeatures": ["query.v1", "trusted-grants.v1", "observation.v0.1", "employee-authority.v1", "provider-connections.v1"],
  "defaultDomainPacks": []
}
