{
  "schemaVersion": "finance-component-assembly.v0.1",
  "kind": "capability-pack",
  "owner": {"id": "fraud-risk-readonly", "version": "0.1.0-rc.1"},
  "requiredFeatures": ["query.v1", "trusted-grants.v1", "observation.v0.1"],
  "defaultDomainPacks": [{"id": "transfer-anti-fraud", "version": "0.1.1-rc.1"}]
}
